colab/me/leelaz_opencl_tuning_K80
1;XgemmBatched;192;25;192;36; -DKWG=32 -DKWI=2 -DMDIMA=8 -DMDIMC=8 -DMWG=32 -DNDIMB=8 -DNDIMC=8 -DNWG=32 -DSA=1 -DSB=1 -DSTRM=0 -DSTRN=0 -DTCE=0 -DVWM=4 -DVWN=2;OpenCL: NVIDIA Corporation Tesla K80 @ 823MHz
1;XgemmBatchedHalf;192;25;192;36; -DKWG=32 -DKWI=2 -DMDIMA=8 -DMDIMC=8 -DMWG=64 -DNDIMB=8 -DNDIMC=8 -DNWG=32 -DSA=1 -DSB=1 -DSTRM=0 -DSTRN=0 -DTCE=0 -DVWM=2 -DVWN=4;OpenCL: NVIDIA Corporation Tesla K80 @ 823MHz
1;XgemmBatched;256;25;256;36; -DKWG=32 -DKWI=8 -DMDIMA=8 -DMDIMC=8 -DMWG=32 -DNDIMB=8 -DNDIMC=8 -DNWG=32 -DSA=1 -DSB=1 -DSTRM=0 -DSTRN=0 -DTCE=0 -DVWM=4 -DVWN=4;OpenCL: NVIDIA Corporation Tesla K80 @ 823MHz
1;XgemmBatchedHalf;256;25;256;36; -DKWG=16 -DKWI=2 -DMDIMA=8 -DMDIMC=8 -DMWG=64 -DNDIMB=8 -DNDIMC=8 -DNWG=32 -DSA=1 -DSB=1 -DSTRM=0 -DSTRN=0 -DTCE=0 -DVWM=4 -DVWN=4;OpenCL: NVIDIA Corporation Tesla K80 @ 823MHz
